{
  "contract_version": "0.1",
  "level_id": "tutorial_01",
  "seed": 42,
  "frame": "mineworld_zup_m",
  "sim": {
    "dt": 0.02
  },
  "mech_spawns": [
    {
      "id": "mech_player",
      "model_ref": "mechs/diffbot_planar.xml",
      "pose": {
        "x": 0.0,
        "y": -0.0,
        "z": 0.5,
        "yaw": 0.0
      },
      "player_slot": 0,
      "control_mode": "velocity",
      "physics_role": "mujoco_authoritative"
    },
    {
      "id": "mech_player_b",
      "model_ref": "mechs/diffbot_planar.xml",
      "pose": {
        "x": 0,
        "y": 2,
        "z": 0.5,
        "yaw": 0
      },
      "player_slot": 1,
      "control_mode": "velocity",
      "physics_role": "mujoco_authoritative"
    }
  ],
  "static_obstacles": [
    {
      "id": "wall_01",
      "shape": "box",
      "size": [
        0.2,
        2.0,
        1.0
      ],
      "pose": {
        "x": 5.0,
        "y": -0.0,
        "z": 0.5,
        "yaw": 0.0
      },
      "physics_role": "mujoco_authoritative"
    }
  ],
  "objectives": [
    {
      "id": "obj_reach_zone",
      "type": "reach_region",
      "target": "trigger_finish",
      "description": "\u5230\u8fbe\u7ec8\u70b9\u533a"
    }
  ],
  "triggers": [
    {
      "id": "trigger_finish",
      "type": "aabb",
      "min": [
        9.0,
        -1.0,
        0.0
      ],
      "max": [
        11.0,
        1.0,
        2.0
      ]
    }
  ],
  "tags": [
    "poc",
    "tutorial"
  ],
  "extensions": {
    "mw": {
      "exported_from": "godot/spike/main.tscn"
    }
  }
}
